{
  "$schema": "sql-compatibility.schema.json",
  "manifest_version": 1,
  "dialect": "CSharpDB SQL",
  "title": "CSharpDB SQL Compatibility",
  "description": "Feature-level compatibility for the CSharpDB SQL dialect. This development snapshot separates current availability from roadmap intent and does not imply compatibility with another vendor dialect.",
  "verified_against": {
    "commit": "522f98de48353f7d7822532ad1c5e3617c4551f3",
    "package_version": "4.0.4",
    "generated_at": "2026-07-17T15:20:19Z",
    "state": "development"
  },
  "proofs": [
    {
      "id": "parser.create_table.basic",
      "kind": "positive",
      "dimension": "parser",
      "project": "tests/CSharpDB.Tests/CSharpDB.Tests.csproj",
      "source": "tests/CSharpDB.Tests/ParserTests.cs",
      "test": "Parse_CreateTable",
      "ci_executed": true
    },
    {
      "id": "parser.select.basic",
      "kind": "positive",
      "dimension": "parser",
      "project": "tests/CSharpDB.Tests/CSharpDB.Tests.csproj",
      "source": "tests/CSharpDB.Tests/ParserTests.cs",
      "test": "Parse_Select_Star",
      "ci_executed": true
    },
    {
      "id": "parser.join.inner",
      "kind": "positive",
      "dimension": "parser",
      "project": "tests/CSharpDB.Tests/CSharpDB.Tests.csproj",
      "source": "tests/CSharpDB.Tests/ParserTests.cs",
      "test": "Parse_InnerJoin",
      "ci_executed": true
    },
    {
      "id": "parser.cte.non_recursive",
      "kind": "positive",
      "dimension": "parser",
      "project": "tests/CSharpDB.Tests/CSharpDB.Tests.csproj",
      "source": "tests/CSharpDB.Tests/ParserTests.cs",
      "test": "Parse_SingleCte",
      "ci_executed": true
    },
    {
      "id": "parser.union.distinct",
      "kind": "positive",
      "dimension": "parser",
      "project": "tests/CSharpDB.Tests/CSharpDB.Tests.csproj",
      "source": "tests/CSharpDB.Tests/ParserTests.cs",
      "test": "Parse_Union",
      "ci_executed": true
    },
    {
      "id": "parser.fk.column",
      "kind": "positive",
      "dimension": "parser",
      "project": "tests/CSharpDB.Tests/CSharpDB.Tests.csproj",
      "source": "tests/CSharpDB.Tests/ParserTests.cs",
      "test": "Parse_CreateTable_WithForeignKeyClause",
      "ci_executed": true
    },
    {
      "id": "parser.fk.table_composite",
      "kind": "positive",
      "dimension": "parser",
      "project": "tests/CSharpDB.Tests/CSharpDB.Tests.csproj",
      "source": "tests/CSharpDB.Tests/ParserTests.cs",
      "test": "Parse_CreateTable_TableLevelCompositeForeignKey",
      "ci_executed": true
    },
    {
      "id": "parser.fk.on_update.rejected",
      "kind": "negative",
      "dimension": "rejection",
      "project": "tests/CSharpDB.Tests/CSharpDB.Tests.csproj",
      "source": "tests/CSharpDB.Tests/ParserTests.cs",
      "test": "Parse_CreateTable_OnlyOnDeleteCascadeIsSupported",
      "ci_executed": true
    },
    {
      "id": "parser.alter.add",
      "kind": "positive",
      "dimension": "parser",
      "project": "tests/CSharpDB.Tests/CSharpDB.Tests.csproj",
      "source": "tests/CSharpDB.Tests/ParserTests.cs",
      "test": "Parse_AlterTable_AddColumn",
      "ci_executed": true
    },
    {
      "id": "parser.alter.drop",
      "kind": "positive",
      "dimension": "parser",
      "project": "tests/CSharpDB.Tests/CSharpDB.Tests.csproj",
      "source": "tests/CSharpDB.Tests/ParserTests.cs",
      "test": "Parse_AlterTable_DropColumn",
      "ci_executed": true
    },
    {
      "id": "parser.alter.rename_table",
      "kind": "positive",
      "dimension": "parser",
      "project": "tests/CSharpDB.Tests/CSharpDB.Tests.csproj",
      "source": "tests/CSharpDB.Tests/ParserTests.cs",
      "test": "Parse_AlterTable_RenameTable",
      "ci_executed": true
    },
    {
      "id": "parser.alter.rename_column",
      "kind": "positive",
      "dimension": "parser",
      "project": "tests/CSharpDB.Tests/CSharpDB.Tests.csproj",
      "source": "tests/CSharpDB.Tests/ParserTests.cs",
      "test": "Parse_AlterTable_RenameColumn",
      "ci_executed": true
    },
    {
      "id": "parser.explain.estimate",
      "kind": "positive",
      "dimension": "parser",
      "project": "tests/CSharpDB.Tests/CSharpDB.Tests.csproj",
      "source": "tests/CSharpDB.Tests/ParserTests.cs",
      "test": "Parse_ExplainEstimateSelect",
      "ci_executed": true
    },
    {
      "id": "parser.explain.mutation.rejected",
      "kind": "negative",
      "dimension": "rejection",
      "project": "tests/CSharpDB.Tests/CSharpDB.Tests.csproj",
      "source": "tests/CSharpDB.Tests/ParserTests.cs",
      "test": "Parse_ExplainEstimateRejectsMutationTarget",
      "ci_executed": true
    },
    {
      "id": "parser.analyze",
      "kind": "positive",
      "dimension": "parser",
      "project": "tests/CSharpDB.Tests/CSharpDB.Tests.csproj",
      "source": "tests/CSharpDB.Tests/ParserTests.cs",
      "test": "Parse_AnalyzeSingleTable",
      "ci_executed": true
    },
    {
      "id": "engine.create_and_query",
      "kind": "positive",
      "dimension": "execution",
      "project": "tests/CSharpDB.Tests/CSharpDB.Tests.csproj",
      "source": "tests/CSharpDB.Tests/IntegrationTests.cs",
      "test": "CreateTable_And_Query",
      "ci_executed": true
    },
    {
      "id": "engine.persistence.reopen",
      "kind": "positive",
      "dimension": "persistence",
      "project": "tests/CSharpDB.Tests/CSharpDB.Tests.csproj",
      "source": "tests/CSharpDB.Tests/IntegrationTests.cs",
      "test": "Persistence_AcrossReopen",
      "ci_executed": true
    },
    {
      "id": "engine.join.inner",
      "kind": "positive",
      "dimension": "execution",
      "project": "tests/CSharpDB.Tests/CSharpDB.Tests.csproj",
      "source": "tests/CSharpDB.Tests/IntegrationTests.cs",
      "test": "InnerJoin",
      "ci_executed": true
    },
    {
      "id": "engine.cte.non_recursive",
      "kind": "positive",
      "dimension": "execution",
      "project": "tests/CSharpDB.Tests/CSharpDB.Tests.csproj",
      "source": "tests/CSharpDB.Tests/IntegrationTests.cs",
      "test": "Cte_SingleBasic",
      "ci_executed": true
    },
    {
      "id": "engine.union.distinct",
      "kind": "positive",
      "dimension": "execution",
      "project": "tests/CSharpDB.Tests/CSharpDB.Tests.csproj",
      "source": "tests/CSharpDB.Tests/IntegrationTests.cs",
      "test": "Union_RemovesDuplicates_AndAppliesOuterOrderBy",
      "ci_executed": true
    },
    {
      "id": "engine.fk.enforcement",
      "kind": "positive",
      "dimension": "execution",
      "project": "tests/CSharpDB.Tests/CSharpDB.Tests.csproj",
      "source": "tests/CSharpDB.Tests/ForeignKeyIntegrationTests.cs",
      "test": "ForeignKeys_InsertRejectsMissingParent_AndAllowsNullChildValue",
      "ci_executed": true
    },
    {
      "id": "engine.fk.restrict",
      "kind": "positive",
      "dimension": "execution",
      "project": "tests/CSharpDB.Tests/CSharpDB.Tests.csproj",
      "source": "tests/CSharpDB.Tests/ForeignKeyIntegrationTests.cs",
      "test": "ForeignKeys_DeleteRestrictPreventsDeletingReferencedParent",
      "ci_executed": true
    },
    {
      "id": "engine.fk.cascade",
      "kind": "positive",
      "dimension": "execution",
      "project": "tests/CSharpDB.Tests/CSharpDB.Tests.csproj",
      "source": "tests/CSharpDB.Tests/ForeignKeyIntegrationTests.cs",
      "test": "ForeignKeys_DeleteCascadeDeletesDependentRows",
      "ci_executed": true
    },
    {
      "id": "engine.fk.drop_constraint",
      "kind": "positive",
      "dimension": "execution",
      "project": "tests/CSharpDB.Tests/CSharpDB.Tests.csproj",
      "source": "tests/CSharpDB.Tests/ForeignKeyIntegrationTests.cs",
      "test": "ForeignKeys_DropConstraint_RemovesEnforcement_AndSupportIndex",
      "ci_executed": true
    },
    {
      "id": "engine.fk.drop_missing.rejected",
      "kind": "negative",
      "dimension": "rejection",
      "project": "tests/CSharpDB.Tests/CSharpDB.Tests.csproj",
      "source": "tests/CSharpDB.Tests/ForeignKeyIntegrationTests.cs",
      "test": "ForeignKeys_DropConstraint_MissingConstraintIsRejected",
      "ci_executed": true
    },
    {
      "id": "engine.fk.composite",
      "kind": "positive",
      "dimension": "execution",
      "project": "tests/CSharpDB.Tests/CSharpDB.Tests.csproj",
      "source": "tests/CSharpDB.Tests/LogicalKeyConstraintTests.cs",
      "test": "CompositeForeignKey_EnforcesMatchSimple_CascadesAndSurvivesReopen",
      "ci_executed": true
    },
    {
      "id": "schema.fk.composite_reopen",
      "kind": "positive",
      "dimension": "persistence",
      "project": "tests/CSharpDB.Tests/CSharpDB.Tests.csproj",
      "source": "tests/CSharpDB.Tests/LogicalKeyConstraintTests.cs",
      "test": "CompositeForeignKey_EnforcesMatchSimple_CascadesAndSurvivesReopen",
      "ci_executed": true
    },
    {
      "id": "schema.fk.composite_vacuum",
      "kind": "positive",
      "dimension": "persistence",
      "project": "tests/CSharpDB.Tests/CSharpDB.Tests.csproj",
      "source": "tests/CSharpDB.Tests/DatabaseMaintenanceTests.cs",
      "test": "VacuumAsync_PreservesOrderedCompositeForeignKeys",
      "ci_executed": true
    },
    {
      "id": "catalog.fk.composite_pairs",
      "kind": "positive",
      "dimension": "catalog",
      "project": "tests/CSharpDB.Tests/CSharpDB.Tests.csproj",
      "source": "tests/CSharpDB.Tests/LogicalKeyConstraintTests.cs",
      "test": "CompositeForeignKey_EnforcesMatchSimple_CascadesAndSurvivesReopen",
      "ci_executed": true
    },
    {
      "id": "engine.fk.composite_dependencies",
      "kind": "positive",
      "dimension": "execution",
      "project": "tests/CSharpDB.Tests/CSharpDB.Tests.csproj",
      "source": "tests/CSharpDB.Tests/LogicalKeyConstraintTests.cs",
      "test": "CompositeForeignKey_RenamesAllParticipatingColumnsAndBlocksDrops",
      "ci_executed": true
    },
    {